{
  "profiles": [
    {
      "kind": "full",
      "logical_families": [],
      "path": "profiles/full-a18b869b2e81.json",
      "profile_id": "full",
      "profile_sha256": "bc254fe031aa621711d197384d14e8d88811f8830163661848b8a1f365b7bee0"
    },
    {
      "kind": "mandatory",
      "logical_families": [],
      "path": "profiles/mandatory-3e80c8f14208.json",
      "profile_id": "mandatory",
      "profile_sha256": "b0b84efefb1a3beea3891634472d1bb243f4873c6bdacf6f06b509329b541103"
    },
    {
      "kind": "family_ablation",
      "logical_families": [
        "ir.cfg-simplification"
      ],
      "path": "profiles/without.ir.cfg-simplification-87ade7dbadb4.json",
      "profile_id": "without.ir.cfg-simplification",
      "profile_sha256": "546445273e0b26b2e790ee5c8635395aaeed375b3e40aae02f09e3c784d00388"
    },
    {
      "kind": "family_ablation",
      "logical_families": [
        "ir.aggregate-scalarization"
      ],
      "path": "profiles/without.ir.aggregate-scalarization-45a2a3013df6.json",
      "profile_id": "without.ir.aggregate-scalarization",
      "profile_sha256": "6acbf95bf798eca5f4d2945f624f27ac4b20ecd9cd186bc5a57989a430326d09"
    },
    {
      "kind": "family_ablation",
      "logical_families": [
        "ir.common-subexpression-elimination"
      ],
      "path": "profiles/without.ir.common-subexpression-elimination-938b01c20b07.json",
      "profile_id": "without.ir.common-subexpression-elimination",
      "profile_sha256": "c8cf7cce55d94d77d1a1aec5dfab9c91cea1851d89d3f0d3101c5269e44fb5db"
    },
    {
      "kind": "family_ablation",
      "logical_families": [
        "ir.constant-propagation"
      ],
      "path": "profiles/without.ir.constant-propagation-6ba66fca4358.json",
      "profile_id": "without.ir.constant-propagation",
      "profile_sha256": "d8c76916f1f57e5893bc330cfc14dfeccdf5b37ddbb00e80a493faa141bbcd77"
    },
    {
      "kind": "family_ablation",
      "logical_families": [
        "ir.instruction-combining"
      ],
      "path": "profiles/without.ir.instruction-combining-be10bf32e990.json",
      "profile_id": "without.ir.instruction-combining",
      "profile_sha256": "50ec46a532056e5d839695221dff5fe5b35a7e5d01bda556e4f8c60a66d710e7"
    },
    {
      "kind": "family_ablation",
      "logical_families": [
        "ir.dead-code-elimination"
      ],
      "path": "profiles/without.ir.dead-code-elimination-2bd271ba94f7.json",
      "profile_id": "without.ir.dead-code-elimination",
      "profile_sha256": "2db6782e1590ac37bc69d87c55d810babdd5e21518cba1126696612f9e7848c7"
    },
    {
      "kind": "family_ablation",
      "logical_families": [
        "ir.global-optimization"
      ],
      "path": "profiles/without.ir.global-optimization-8116eaf03b5b.json",
      "profile_id": "without.ir.global-optimization",
      "profile_sha256": "39d271c82f9ab3b132f550c7e36adf9dc58ec95e00d2e8c931b623bb36bed650"
    },
    {
      "kind": "family_ablation",
      "logical_families": [
        "ir.ranked-recurrence-tabulation"
      ],
      "path": "profiles/without.ir.ranked-recurrence-tabulation-e09d9033e438.json",
      "profile_id": "without.ir.ranked-recurrence-tabulation",
      "profile_sha256": "ea71281f3cc6744cfdcf01fa755c3522716a299006cbb7ae7564ac29501a9403"
    },
    {
      "kind": "family_ablation",
      "logical_families": [
        "ir.induction-variable-optimization"
      ],
      "path": "profiles/without.ir.induction-variable-optimization-f2294d118bc0.json",
      "profile_id": "without.ir.induction-variable-optimization",
      "profile_sha256": "52ce302c55876e0b0d2c402babab918631104dac961d8340f605a408ec95510d"
    },
    {
      "kind": "family_ablation",
      "logical_families": [
        "ir.affine-loop-summarization"
      ],
      "path": "profiles/without.ir.affine-loop-summarization-514beaf503c5.json",
      "profile_id": "without.ir.affine-loop-summarization",
      "profile_sha256": "1b4b2202d964538f329733e0f45c260e684ffabe9ab5376b550c633c7af8957c"
    },
    {
      "kind": "family_ablation",
      "logical_families": [
        "ir.reduction-pushdown"
      ],
      "path": "profiles/without.ir.reduction-pushdown-61aba5d53bcd.json",
      "profile_id": "without.ir.reduction-pushdown",
      "profile_sha256": "58e1cd4d8f5a6dfd6571f03be8bc52430ef87d457df681179dded0f5c7e78cdf"
    },
    {
      "kind": "family_ablation",
      "logical_families": [
        "ir.loop-interchange"
      ],
      "path": "profiles/without.ir.loop-interchange-244aef11f265.json",
      "profile_id": "without.ir.loop-interchange",
      "profile_sha256": "d04048cb0734ccc616eea69968d6a48af1fcc0d73a4e7947c3180391994f6c23"
    },
    {
      "kind": "family_ablation",
      "logical_families": [
        "ir.loop-rotation"
      ],
      "path": "profiles/without.ir.loop-rotation-0bd70e44baa1.json",
      "profile_id": "without.ir.loop-rotation",
      "profile_sha256": "60d96d807fb6e86b0ba2bce8e3075eda01422a8e9d7faac2a19cbab02a6d34f6"
    },
    {
      "kind": "family_ablation",
      "logical_families": [
        "ir.loop-memory-optimization"
      ],
      "path": "profiles/without.ir.loop-memory-optimization-777c8486a614.json",
      "profile_id": "without.ir.loop-memory-optimization",
      "profile_sha256": "b24f9e173a6282a56319412ec091bc1b86a572b2b2f9f062614735c43a1492e4"
    },
    {
      "kind": "family_ablation",
      "logical_families": [
        "ir.loop-unrolling"
      ],
      "path": "profiles/without.ir.loop-unrolling-2aa7c73d7930.json",
      "profile_id": "without.ir.loop-unrolling",
      "profile_sha256": "7b70219ea3b2beff8011c7cc692f689b2da46fe1ee0e2de163ccee88edcdafe2"
    },
    {
      "kind": "family_ablation",
      "logical_families": [
        "integer.constant-arithmetic-strength-reduction"
      ],
      "path": "profiles/without.integer.constant-arithmetic-strength-reduction-5adbf3ce02e7.json",
      "profile_id": "without.integer.constant-arithmetic-strength-reduction",
      "profile_sha256": "a61308178c42661b7843e3eceaec342182942382b7a53323dc8f8a64c532d91e"
    },
    {
      "kind": "family_ablation",
      "logical_families": [
        "ir.tail-recursion-elimination"
      ],
      "path": "profiles/without.ir.tail-recursion-elimination-115ef9b3dc9f.json",
      "profile_id": "without.ir.tail-recursion-elimination",
      "profile_sha256": "49bdee98bd71b0ef6c4fbee5938fde3a0f017302076ef56ca77c6675d33e9edf"
    },
    {
      "kind": "family_ablation",
      "logical_families": [
        "ir.inlining"
      ],
      "path": "profiles/without.ir.inlining-362f89354771.json",
      "profile_id": "without.ir.inlining",
      "profile_sha256": "8fefef1516a7eb511dbf7548e58eb265c0178d50a51c3706350ac8413b9296b2"
    },
    {
      "kind": "family_ablation",
      "logical_families": [
        "backend.copy-propagation"
      ],
      "path": "profiles/without.backend.copy-propagation-a432d649feef.json",
      "profile_id": "without.backend.copy-propagation",
      "profile_sha256": "9e8727921b3a866d764cdc2b63c4b621955b3da9fa2c28eee1a04a4a8b9097e9"
    },
    {
      "kind": "family_ablation",
      "logical_families": [
        "backend.address-optimization"
      ],
      "path": "profiles/without.backend.address-optimization-2840bbc5fc00.json",
      "profile_id": "without.backend.address-optimization",
      "profile_sha256": "f4d7e31c24b119596e08d3b6c5633b867d8250213d1a196ffb84824d12b26370"
    },
    {
      "kind": "family_ablation",
      "logical_families": [
        "backend.common-subexpression-elimination"
      ],
      "path": "profiles/without.backend.common-subexpression-elimination-86bab36ac5c0.json",
      "profile_id": "without.backend.common-subexpression-elimination",
      "profile_sha256": "93b4272f287172267ac86f35b216deb11dab7330da7970345a678fd51469b06e"
    },
    {
      "kind": "family_ablation",
      "logical_families": [
        "backend.loop-optimization"
      ],
      "path": "profiles/without.backend.loop-optimization-fe5049a2719b.json",
      "profile_id": "without.backend.loop-optimization",
      "profile_sha256": "93ec28488426d44c52ff0e8f20c8c635ee27dc988d7ace701124cf2f0bcc6ca0"
    },
    {
      "kind": "family_ablation",
      "logical_families": [
        "backend.block-layout"
      ],
      "path": "profiles/without.backend.block-layout-68c9f6c665b4.json",
      "profile_id": "without.backend.block-layout",
      "profile_sha256": "689ce5ce1b601d92b66416383409bc39b2db0c02afc024d343a6cd15c633cc5f"
    }
  ],
  "registry_sha256": "64832c665795e6da085b521b2460deaaf00c29bdbdb48aa72ef28641ceb441b8",
  "schedule": [
    {
      "baseline_profile_id": "full",
      "candidate_profile_id": "mandatory",
      "kind": "mandatory_control"
    },
    {
      "baseline_profile_id": "full",
      "candidate_profile_id": "without.ir.cfg-simplification",
      "kind": "family_ablation"
    },
    {
      "baseline_profile_id": "full",
      "candidate_profile_id": "without.ir.aggregate-scalarization",
      "kind": "family_ablation"
    },
    {
      "baseline_profile_id": "full",
      "candidate_profile_id": "without.ir.common-subexpression-elimination",
      "kind": "family_ablation"
    },
    {
      "baseline_profile_id": "full",
      "candidate_profile_id": "without.ir.constant-propagation",
      "kind": "family_ablation"
    },
    {
      "baseline_profile_id": "full",
      "candidate_profile_id": "without.ir.instruction-combining",
      "kind": "family_ablation"
    },
    {
      "baseline_profile_id": "full",
      "candidate_profile_id": "without.ir.dead-code-elimination",
      "kind": "family_ablation"
    },
    {
      "baseline_profile_id": "full",
      "candidate_profile_id": "without.ir.global-optimization",
      "kind": "family_ablation"
    },
    {
      "baseline_profile_id": "full",
      "candidate_profile_id": "without.ir.ranked-recurrence-tabulation",
      "kind": "family_ablation"
    },
    {
      "baseline_profile_id": "full",